{
  "$schema": "../schema/deepening.schema.json",
  "conceptId": "marge-de-manoeuvre",
  "lead": [
    "Imaginons deux personnes qui font le même travail : contrôler des pièces sur une chaîne, par exemple, ou poser un même geste toute la journée. Elles reçoivent la même consigne, mais devant elles, plusieurs fois par jour, une pièce mal formée, un outil qui coince, une commande arrivée en retard. La première peut changer de posture, reprendre le geste autrement, décaler l’ordre des opérations pour absorber l’incident sans casser le rythme. La seconde n’a droit qu’à une seule façon de faire, fixée d’avance, et doit s’y tenir même quand elle ne convient plus à ce qui se présente.",
    "Cette différence, pouvoir s’y prendre de plusieurs façons plutôt que d’une seule, porte un nom en ergonomie : la marge de manœuvre. Un article de 2003 signé par Fabien Coutarel, François Daniellou et Bernard Dugué en fait l’élément central d’un raisonnement sur la santé au travail. Leur idée n’est pas qu’il vaut mieux avoir le choix par confort. Elle est plus précise : qui n’a droit qu’à un seul geste possible, et rencontre un imprévu, n’a plus qu’à forcer le geste ou à laisser l’incident non traité. C’est cette impasse-là, répétée tout au long d’une journée, que la notion cherche à nommer."
  ],
  "sections": [
    {
      "title": "Faire toujours pareil, ou pouvoir varier",
      "paragraphs": [
        "Le texte distingue deux types de situations de travail. Certaines sont, selon la formule employée, « très déterminées du point de vue des modes opératoires possibles » : une seule façon de procéder est admise, s’en écarter n’est pas prévu. D’autres offrent au contraire « la possibilité d’utiliser une diversité de modes opératoires » pour arriver au même résultat. Rien, dans cette opposition, ne porte sur la difficulté du travail ni sur l’effort qu’il demande : deux postes également pénibles peuvent différer uniquement sur ce point, l’un enfermant dans un seul geste, l’autre laissant plusieurs chemins ouverts vers le même résultat.",
        "Ce que permet la diversité, c’est « de faire face aux variabilités » du travail réel : une pièce qui n’a pas tout à fait la forme prévue, un outil qui manque, un collègue absent, un incident sur la machine. Quand une seule façon de faire est admise, chacun de ces écarts par rapport à ce qui était prévu tombe sur la même impasse : suivre une consigne devenue inadaptée, ou l’enfreindre. Quand plusieurs façons sont possibles, l’imprévu se traite en changeant de mode opératoire, sans avoir à choisir entre obéir et se mettre en tort."
      ]
    },
    {
      "title": "Le contrôle sur sa situation de travail",
      "paragraphs": [
        "Le texte formule ainsi le lien qu’il pose entre cette liberté et la santé : « D’une manière générale, la notion de marge de manœuvre établit un lien entre la santé et le contrôle de chacun sur sa situation de travail ». Le mot contrôle, ici, ne désigne pas une hiérarchie qui surveille. Il désigne la possibilité, pour la personne qui travaille, d’agir sur la façon dont sa propre situation se déroule : choisir un geste plutôt qu’un autre, décider du moment où intervenir, ajuster l’ordre des opérations. C’est ce contrôle-là, et non un supplément de confort, que l’absence de marge de manœuvre retire.",
        "L’article s’inscrit dans un travail sur les troubles musculo-squelettiques, ces douleurs du dos, de l’épaule ou du poignet que des gestes répétés dans une position contrainte peuvent produire. Son hypothèse est que la répétition seule n’explique pas tout : une personne qui répète un geste mais peut le faire varier n’est pas, selon cette hypothèse, dans la même situation que celle qui répète ce même geste sans aucune variation possible. La seconde situation prive à la fois d’ajustement et de protection."
      ]
    },
    {
      "title": "Concevoir un poste, le faire tourner",
      "paragraphs": [
        "La marge de manœuvre, dans ce texte, ne se joue pas à un seul moment. « Cette notion se décline de deux manières, selon que l’on s’intéresse à une situation de conception ou à une situation de fonctionnement ». Une situation de conception, c’est le moment où un poste, un outil, une organisation sont encore en projet : on peut alors décider d’y laisser de la place pour plusieurs façons de faire, ou au contraire de tout fixer d’avance.",
        "Une situation de fonctionnement, c’est ce même poste une fois en service, tel que les personnes qui l’occupent le rencontrent au jour le jour. Une marge peut y exister sans avoir été prévue à la conception, quand les habitudes prises sur place en ouvrent une ; elle peut aussi manquer alors même que la conception l’avait envisagée, si l’organisation en cours d’usage la referme. Distinguer les deux moments évite de chercher à un seul endroit ce qui se joue, et se perd ou se gagne, à deux endroits différents."
      ]
    },
    {
      "title": "Une notion qui ne se distingue pas de ses voisines",
      "paragraphs": [
        "D’autres traditions décrivent une idée voisine sous d’autres noms : le contrôle perçu sur son travail, la latitude décisionnelle, ce que le modèle de Karasek et Theorell appelle le job latitude, ou encore ce qu’on nomme parfois l’activité empêchée. Le texte ne prend pas soin de les séparer. Il en fait au contraire un ensemble, en laissant délibérément de côté les différences de méthode et de vocabulaire entre les disciplines qui les ont chacune élaborées de leur côté.",
        "Karasek et Theorell n’apparaissent qu’une fois, cités comme référence pour des travaux d’épidémiologie sur le lien entre le travail et la santé cardiovasculaire, jamais comme un modèle dont la marge de manœuvre aurait à se démarquer. Le choix du texte est ainsi de nommer un phénomène assez général, la possibilité ou non de s’y prendre autrement, plutôt que de trancher entre les cadres théoriques qui, chacun à sa manière, l’avaient déjà décrit avant lui."
      ]
    },
    {
      "title": "Ce que la marge de manœuvre rend possible",
      "paragraphs": [
        "Reste à dire pourquoi cette possibilité compte concrètement. En ergonomie, on appelle régulation l’ajustement qu’une personne fait, en cours d’action, pour continuer à atteindre ce qu’on lui demande malgré ce qui contrarie la façon prévue d’y parvenir : une posture changée pour soulager un bras, un ordre des tâches inversé pour rattraper un retard, une pause pour absorber une fatigue naissante. Le texte présente la marge de manœuvre comme la condition de ces ajustements : sans plusieurs façons possibles de faire, il n’y a rien à ajuster, seulement une consigne à suivre ou à rompre.",
        "C’est ce point qui referme la boucle avec la santé. Une personne qui régule en permanence son activité, qui peut absorber les petites variations d’une journée de travail sans jamais être mise en défaut, s’épargne une contrainte que subit, geste après geste, celle qui n’a qu’une seule voie possible. La marge de manœuvre n’est donc pas un supplément d’autonomie accordé par générosité : dans ce raisonnement, elle est la ressource qui permet, ou empêche, de faire face à ce que le travail présente d’imprévisible."
      ]
    }
  ],
  "limits": [
    "L’origine de la notion elle-même n’est pas établie ici. Le texte de 2003 ne revendique pas de l’avoir inventée : il la rattache à l’ergonomie francophone en général et ne cite comme antécédent qu’un texte de Douillet et Schweitzer, publié en 2002, qui aurait « suggéré cette piste de réflexion autour des marges de manœuvre sans toutefois aller plus loin ». Qui a le premier employé l’expression, et à quelle date, reste hors de portée des sources consultées ici.",
    "Une thèse de 2004 du même premier auteur propose une généalogie plus large, en écrivant qu’« il n’existe pas réellement de définition établie de la notion de marge de manœuvre pour approcher les situations de travail » avant de citer plusieurs travaux antérieurs sur ce thème. Ces travaux n’ont pas été ouverts directement : ce qu’ils avancent n’est connu ici que par la façon dont cette thèse les rapporte, et ne peut pas être garanti au-delà.",
    "Le lien entre la marge de manœuvre et l’idée plus large de régulation, telle que l’ergonomie francophone l’a développée par ailleurs, n’est pas discuté dans le texte de 2003 : aucun texte de référence sur la régulation n’y est cité ni examiné. Établir précisément ce lien demanderait de lire ces textes-là directement, ce qui n’a pas été fait pour ce texte.",
    "La notion s’est visiblement transformée après 2003, avec une distinction ultérieure entre une marge de manœuvre propre à une situation donnée et des marges de manœuvre considérées au pluriel, une distinction absente du texte examiné ici. Les travaux qui portent cette évolution n’ont pas été consultés, et rien ne peut donc être dit sur ce qu’ils avancent."
  ]
}
