{
  "$schema": "../schema/deepening.schema.json",
  "conceptId": "debat-de-normes",
  "lead": [
    "Une infirmière doit administrer un médicament en suivant un protocole écrit pour éviter les erreurs. Le patient qu’elle a devant elle n’est pourtant jamais tout à fait celui que le protocole avait en tête : ses antécédents médicaux ne sont pas tous connus, le produit prescrit n’est plus en stock, il a peur et comprend mal ce qu’on lui demande. Elle doit décider, sur le moment, ce qu’il convient réellement de faire. Suit-elle encore la règle, ou bien s’en écarte-t-elle ?",
    "Cette situation n’a rien d’exceptionnel : elle se répète, sous une forme ou une autre, dans presque tout travail réglé par des règles, qu’il s’agisse d’un protocole, d’une consigne, d’une recette ou d’une habitude de métier. Aucune règle écrite à l’avance ne peut prévoir exactement ce qu’exigera chaque situation réelle. Le philosophe et ergologue Yves Schwartz a donné un nom à ce qui se joue alors : un débat de normes, c’est-à-dire une confrontation entre ce qui était prévu avant d’agir et ce que la situation, une fois là, réclame vraiment. Il n’y voit pas un incident regrettable, mais un trait permanent de toute activité de travail."
  ],
  "sections": [
    {
      "title": "Ce que la règle ne peut jamais tout dire",
      "paragraphs": [
        "Dans l’exemple de l’infirmière, il y a d’un côté ce qui est écrit noir sur blanc avant qu’elle agisse : la dose, l’horaire, la procédure à suivre. On appelle cela le travail prescrit. Il y a de l’autre ce qu’elle fait effectivement, avec les moyens du moment, une fois dans la chambre du patient : le travail réel. Les deux ne coïncident jamais tout à fait, et ce n’est pas un défaut de rédaction de la procédure. Aucune consigne, même détaillée, ne peut décrire à l’avance toutes les situations où elle devra s’appliquer.",
        "C’est de cette distinction, bien connue de qui étudie le travail, que l’auteur part pour poser un problème plus large. Ce qu’il observe à propos d’un poste de travail précis vaut, selon lui, pour l’activité humaine en général : « […] des débats de normes ne cessent d’occuper, de saisir l’activité humaine […] ». Le travail prescrit n’est donc qu’un cas particulier d’un phénomène plus vaste : à chaque instant d’une activité, quelque chose qui avait été fixé à l’avance se trouve remis en jeu par ce qu’il faut faire réellement."
      ]
    },
    {
      "title": "Des règles plus anciennes que la tâche du jour",
      "paragraphs": [
        "Le mot « norme » peut sembler abstrait ; il désigne ici, très simplement, tout ce qui est fixé avant qu’une personne commence à agir et qui oriente ce qu’elle doit faire. Une consigne écrite en est une. Mais il y en a bien d’autres : l’habitude prise dans un service, la façon dont les collègues procèdent, une règle de métier jamais écrite nulle part, une attente implicite de la hiérarchie. Toutes précèdent l’activité ; c’est en ce sens qu’on peut les dire antécédentes.",
        "Le travail prescrit, celui que décrit une procédure officielle, n’est donc qu’une norme antécédente parmi d’autres, et elle n’est pas toujours la plus déterminante. Il arrive qu’une habitude de métier pèse davantage que la consigne du jour, ou que deux normes antécédentes se contredisent : ce que demande le protocole n’est pas toujours ce qu’attendent les collègues, ni ce qu’impose l’urgence de la situation. Reconnaître cette pluralité change la question posée au début : ce n’est pas seulement la règle écrite qui se discute dans l’action, c’est tout un ensemble de normes plus anciennes que la tâche elle-même."
      ]
    },
    {
      "title": "Refaire la norme en la suivant",
      "paragraphs": [
        "Suivre une norme antécédente n’est presque jamais l’appliquer telle quelle : il faut la faire tenir dans une situation qu’elle n’avait pas prévue. Imaginons un cuisinier qui suit une recette précise, mais reçoit ce matin-là un poisson plus petit que d’habitude, dans une cuisine où un four est en panne. Respecter la recette au sens strict serait absurde ; l’ignorer complètement livrerait un plat raté. Ce qu’il fait, en réalité, c’est retravailler la recette pour qu’elle produise encore ce qu’elle était censée produire, avec ce qu’il a sous la main.",
        "C’est ce mouvement que l’auteur appelle une renormalisation : reprendre une norme, non pour la rejeter, mais pour la faire vivre dans une situation où, telle quelle, elle ne suffirait pas. Ce n’est ni de la désobéissance ni de l’improvisation pure : la norme antécédente reste le point de départ, mais elle doit être retravaillée pour que le travail se fasse réellement. Une partie de ce qui fait la compétence d’un métier tient précisément dans cette capacité à renormaliser sans le dire, sans même toujours s’en apercevoir."
      ]
    },
    {
      "title": "Un débat qui ne s’arrête jamais",
      "paragraphs": [
        "Ce débat entre normes antécédentes et renormalisation n’est pas un épisode occasionnel, réservé aux imprévus ou aux situations dégradées. L’auteur insiste sur sa permanence : ces débats « ne cessent d’occuper » l’activité humaine, à chaque instant, y compris dans les tâches les plus réglées et les plus répétitives. Même un geste apparemment mécanique suppose un minimum d’ajustement de la personne qui l’exécute à l’instant précis où elle l’exécute.",
        "Cela déplace le regard porté sur les écarts au travail. Un écart entre ce qui était prescrit et ce qui a été fait n’est pas d’abord un signe d’erreur ou de négligence à corriger : il peut être la trace normale, attendue, du travail en train de se faire. Une organisation qui chercherait à supprimer entièrement ces écarts ne supprimerait pas les difficultés du travail, elle empêcherait seulement les personnes de les résoudre."
      ]
    },
    {
      "title": "Ce que ce débat coûte, ou apporte, à la santé",
      "paragraphs": [
        "Cette idée de débat entre des normes n’appartient pas seulement à l’auteur : il la reprend explicitement de Georges Canguilhem, qu’il mentionne douze fois dans le texte où il développe cette analyse du travail. On peut comprendre l’apport de Canguilhem ainsi : être en bonne santé n’est pas seulement subir sans dommage des normes venues de l’extérieur, c’est pouvoir, soi-même, en produire. L’auteur reprend cette idée en des termes très proches, en évoquant une pensée de la santé « comme un débat toujours renouvelé entre des normes anonymes venant de l’environnement, et des normes que chaque être vivant produit et essaie de promouvoir ».",
        "Transposée au travail, cette idée a une conséquence directe : la façon dont une personne renormalise ce qui lui est demandé n’est pas un détail technique, c’est ce qui est en jeu pour sa santé. L’auteur décrit cela comme « une tentative reconduite jour après jour d’assurer sa propre santé […] c’est une tentative pour créer de l’espace social, de l’espace industrieux pour ses propres normes de vie ». Autrement dit, pouvoir peser, même modestement, sur les normes qui organisent son activité fait partie de ce qui permet de tenir dans son travail, et pas seulement de l’exécuter."
      ]
    },
    {
      "title": "Ce que ce débat n’autorise pas à conclure",
      "paragraphs": [
        "Reconnaître ce débat permanent ne revient pas à dire que toute règle est arbitraire, ni que s’en écarter serait toujours légitime. La renormalisation, telle que l’auteur la présente, part de la norme antécédente et la retravaille ; elle ne consiste pas à l’ignorer. Imaginons, à l’inverse, un employé qui déciderait unilatéralement d’ignorer une consigne de sécurité sous prétexte qu’elle le ralentit : ce ne serait pas un débat de normes, ce serait un renoncement pur et simple à la norme antécédente, sans rien mettre à sa place qui réponde au même besoin.",
        "La distinction entre norme antécédente et renormalisation est ici un outil pour décrire ce qui se passe dans l’activité, et non une classification stricte que l’auteur imposerait à chaque geste observé. Elle sert surtout à déplacer une question habituelle : au lieu de demander seulement si une personne a bien suivi la règle, elle invite à demander ce que cette personne a dû faire, en plus de la règle, pour que le travail se fasse réellement."
      ]
    }
  ],
  "limits": [
    "Une expression proche, « usage de soi », est parfois associée au même auteur ; elle n’apparaît pas une seule fois dans le texte de 2007. Comment les deux formules s’articulent, et si la seconde ajoute quelque chose que la première ne dit pas, se décidera dans les textes où l’auteur emploie l’une et l’autre, pas dans ce qui précède.",
    "L’expression « débats de normes » figure aussi, en 2004, dans le titre d’un chapitre antérieur du même auteur. Ce chapitre est le premier endroit à ouvrir pour qui veut dater la formule : de ce qui précède, seule sa présence dans l’article de 2007 peut être affirmée avec certitude.",
    "Ce que l’article affirme est rapporté plus haut tel quel, sans les discussions qu’il a pu susciter. La façon dont d’autres chercheurs l’ont reçu, prolongé ou contesté forme une littérature à part entière, et c’est en la lisant qu’on saura ce que cette proposition est devenue une fois sortie des mains de son auteur."
  ]
}
