{
  "$schema": "../schema/deepening.schema.json",
  "conceptId": "glissements-de-l-action",
  "lead": [
    "Il arrive qu’on range le beurre dans le placard et le café au réfrigérateur, qu’on parte poster une lettre et qu’on rentre avec la lettre encore en poche, ou qu’on tape le code de son téléphone sur le clavier d’un distributeur de billets. Aucun de ces incidents ne vient d’une ignorance : on sait parfaitement où va le beurre et pourquoi on est sorti. Aucun ne vient non plus d’un mauvais calcul, puisqu’il n’y a pas eu de calcul du tout. Le but était juste, il l’est resté, et les mains ont fait autre chose.",
    "Le mot « erreur », en français courant, désigne aussi bien ces accrocs que les décisions qu’on regrette après coup, alors que les deux n’ont presque rien en commun. Un rapport que Donald A. Norman écrit à l’université de Californie à San Diego, en novembre 1979, sépare les deux et ne retient que les premiers. Son pari : ces incidents minuscules ne sont pas du bruit, ils ont des causes repérables, et ils renseignent sur la façon dont une intention devient un geste. Encore faut-il, pour les étudier, tracer une frontière que la langue ordinaire ne trace pas."
  ],
  "sections": [
    {
      "title": "L’intention tenue pour acquise",
      "paragraphs": [
        "Le premier geste de Norman est un geste de méthode, et il est explicite. Page 9 du rapport : « Here I start with intentions as given », je pars ici des intentions comme si elles étaient données. Autrement dit, la question de savoir comment quelqu’un en vient à vouloir ce qu’il veut est mise de côté. Ce qui est étudié commence après : une intention est là, elle est bonne, et le corps ne la suit pas. Le tableau récapitulatif de la page 10 range d’ailleurs sous une rubrique explicite ce qui reste dehors, « Errors that are not classified as slips » : les erreurs de détermination des buts, de décision et de résolution de problème.",
        "Cette exclusion n’est pas un jugement sur l’importance des erreurs de jugement, c’est un découpage d’objet. Se tromper de but et faire autre chose que ce qu’on avait décidé sont deux phénomènes distincts ; Norman n’en instruit qu’un, et le dit. Un point mérite d’être signalé à qui connaît la suite de cette littérature : ce rapport ne construit pas de couple de termes opposés, et le mot « mistake » n’y est pas employé comme terme technique faisant pendant à « slip ». La frontière y est posée par décision de méthode, pas par contraste de vocabulaire."
      ]
    },
    {
      "title": "Les erreurs qu’on rattrape soi-même",
      "paragraphs": [
        "Un fait ordinaire retient Norman page 5 : beaucoup de ces erreurs sont interceptées au moment même où on les commet. La main s’arrête à mi-course, le mot se corrige avant d’être fini, on repose l’objet qu’on venait de prendre sans savoir pourquoi on l’avait pris. L’erreur a donc été engagée, puis attrapée. Norman en tire une conséquence qui ne va pas de soi : pour qu’une action soit lancée puis interrompue de l’intérieur, il faut qu’existe un mécanisme qui surveille le comportement, et ce mécanisme doit être distinct de celui qui sélectionne et exécute l’acte.",
        "C’est là que se joue l’intérêt du glissement, et le titre de la section où la définition est posée le dit sans détour : « Slips: Window to the Mind », le glissement comme fenêtre sur l’esprit. Une action réussie ne renseigne guère sur la façon dont elle a été produite, parce que tout s’y est passé sans accroc et sans trace. Une action qui dérape, puis se rattrape, laisse au contraire deviner qu’il y avait au moins deux instances au travail, et qu’elles ne travaillaient pas au même rythme."
      ]
    },
    {
      "title": "Des habitudes qui se déclenchent seules",
      "paragraphs": [
        "Pour rendre compte de cela, Norman propose que les séquences d’action habiles soient commandées par des structures de connaissance sensori-motrices qu’il nomme des schémas : des unités de mémoire organisées, du même genre que celles qu’on invoque pour la perception et le souvenir, étendues cette fois aux mouvements. Un schéma n’est pas le souvenir d’un geste passé, c’est un geste disponible, prêt à tourner : faire un créneau, verrouiller une porte, taper un code. Une fois qu’il est en route, il se déroule largement sans qu’on ait à le surveiller, et c’est précisément ce qui fait son efficacité.",
        "Reste à savoir ce qui lance un schéma plutôt qu’un autre. Norman distingue ici deux choses qu’on confond facilement. Un schéma peut être plus ou moins activé, c’est-à-dire plus ou moins disponible sur le moment ; mais l’activation ne suffit pas à le mettre en marche, il y faut encore des conditions de déclenchement, un ensemble de circonstances qui l’appellent. D’où une catégorie entière d’incidents, que le rapport formule ainsi page 17 : « A schema may be properly selected and activated, but lead to a slip because it is triggered improperly, either at the wrong time or not at all. » Un schéma peut être correctement sélectionné et activé, et conduire pourtant à un glissement parce qu’il se déclenche mal, au mauvais moment ou pas du tout.",
        "Norman emprunte à William James un cas qui montre la chose en entier : celui de personnes très distraites qui, montées dans leur chambre pour s’habiller avant le dîner, ôtent un vêtement après l’autre et finissent par se coucher, parce que se mettre au lit était l’aboutissement habituel des premiers gestes accomplis à une autre heure. Rien n’a été décidé, rien n’a été oublié. Les premiers mouvements appartenaient à deux séquences à la fois, et c’est la plus fréquente qui a pris la main."
      ]
    },
    {
      "title": "Trois catégories, ou quatre",
      "paragraphs": [
        "Le classement que Norman propose ne trie pas les incidents par leur allure mais par l’endroit de la chaîne où quelque chose a lâché. Deux accrocs qui se ressemblent peuvent ainsi se retrouver dans des rubriques différentes, et deux accrocs sans ressemblance apparente dans la même. Le tableau de la page 10 en donne trois : les glissements qui tiennent à la formation de l’intention, ceux qui tiennent à l’activation, ceux qui tiennent au déclenchement. Le corps du texte, page 9, en annonce quatre, et ajoute aux trois précédents l’exécution de l’acte elle-même.",
        "Le rapport se contredit donc d’une rubrique selon l’endroit où on le lit, et la quatrième ne figure pas dans le tableau. Ce n’est pas une coquetterie : c’est la trace d’une classification en train de se faire, dans un texte de travail dactylographié pour un centre de recherche, et non dans un traité stabilisé. Qui voudra avancer un nombre devra donc préciser lequel des deux endroits il suit. Ce que le désaccord ne remet pas en cause, en revanche, c’est le principe : une même définition, plusieurs sources présumées, et un classement qui suit ces sources."
      ]
    },
    {
      "title": "Un mot pris au lapsus de parole",
      "paragraphs": [
        "Le mot n’est pas de Norman, et il ne le revendique nulle part. En anglais, « slip » désigne d’abord le lapsus, le mot qui échappe, et il arrive dans ce rapport chargé de toute une tradition, freudienne et linguistique, que Norman assume explicitement page 3 en rappelant ce que Freud a tiré de l’analyse des erreurs. Ce qu’il déclare faire est un déplacement d’objet, écrit page 2 : « the study of slips, especially slips of performance and actions (as opposed to slips of the tongue) », l’étude des glissements, et particulièrement de ceux de l’exécution et de l’action, par opposition à ceux de la langue. La psychologie du lapsus change de terrain : elle quitte la parole pour le geste.",
        "La matière, elle, n’a rien d’expérimental et n’a pas été rassemblée par un seul homme. Les remerciements de la page 29 créditent le groupe de recherche LNR d’avoir constitué la collection d’incidents et discuté l’analyse des exemples, et distinguent l’un de ses membres : « In particular, Jonathan Grudin was an avid collector and analyzer of slips. » Norman s’appuie par ailleurs sur les relevés de James Reason, qu’il cite dans le corps du texte et à qui il emprunte des incidents. Ce sont donc des accrocs de la vie ordinaire, notés au vol par des gens attentifs à leurs propres ratés, qui servent de base à la classification."
      ]
    }
  ],
  "limits": [
    "Deux ans plus tard, Norman en publie une version révisée sous un autre titre, « Categorization of action slips », dans la Psychological Review de 1981. Le titre a changé avec le texte. C’est dans ces quinze pages que la classification a pris sa forme publiée, et pour savoir ce qu’y sont devenues ces rubriques, il faudra les ouvrir.",
    "Le rapport lui-même est en accès libre, et il excède de loin ce qui précède. Ses pages 12 à 14 et 19 à 28 portent la suite des exemples classés, ainsi que la discussion du contrôle, du retour d’information et des théories cybernétiques que le résumé annonce. Le mécanisme de surveillance évoqué plus haut n’apparaît ici que par la phrase qui l’appelle : ces pages attendent leur lecteur.",
    "Restent les racines, que Norman nomme sans les déplier. Freud et la tradition linguistique du lapsus d’un côté, pour ce que le mot portait avant de passer à l’action. James Reason de l’autre, dont les références du rapport donnent « Actions not as planned », paru en 1979 dans un volume collectif sur la conscience : les incidents que Norman lui emprunte y sont chez eux, avec l’analyse qu’il en donne."
  ]
}
