{
  "$schema": "../schema/deepening.schema.json",
  "conceptId": "concevoir-pour-l-activite",
  "lead": [
    "Prenons un escalier. Une fois construit, sa forme s’impose à quiconque le monte : il ne demande son avis à personne, il ne s’adapte à personne. C’est l’exemple que prend le chercheur en ergonomie Pascal Béguin pour parler d’un phénomène plus général, qui touche tout outil de travail. Un logiciel de gestion, une machine de production, un poste de contrôle portent, comme l’escalier, une idée déjà faite de qui va s’en servir et de comment il va travailler. Cette idée n’est écrite nulle part : elle est prise dans la forme même de l’objet, et elle agit avant que quiconque y ait touché.",
    "Béguin appelle ce phénomène cristalliser, un mot pris à la chimie : une solution cristallise quand ce qui était en suspension se fige d’un coup en une forme dure. Ce qui s’est figé dans l’escalier, dans le logiciel ou dans la machine, c’est une certaine idée du travail que quelqu’un a eue au moment de le concevoir. Une fois l’objet construit, cette idée devient une contrainte que tout le monde doit subir, qu’elle soit juste ou fausse. La question que pose ce texte est alors simple : qui a eu cette idée, sur quelle base, et que se passe-t-il quand elle est mauvaise ?"
  ],
  "sections": [
    {
      "title": "Ce que « cristalliser » veut dire ici",
      "paragraphs": [
        "Dans le texte où il expose cette idée, en 2007, Béguin écrit que l’idée centrale est que tout dispositif technique, tout artefact, « cristallise » une connaissance, une représentation, et au sens le plus large un modèle de l’utilisateur et de son activité. La phrase avance par paliers : d’abord une connaissance, quelque chose de précis et de local ; puis une représentation, déjà plus large ; puis, au sens le plus englobant, un modèle entier de la personne qui va utiliser l’objet et de la façon dont elle va s’y prendre.",
        "Ce n’est pas un cas particulier. « Il s’agit d’une caractéristique générale », écrit Béguin, valable aussi bien pour un escalier que pour un logiciel de gestion des stocks ou un tableau de bord industriel. Aucun objet technique n’échappe à cette cristallisation : la question n’est jamais de savoir si un objet porte un modèle de celui qui va s’en servir, mais lequel, et si ce modèle correspond à quelque chose de réel."
      ]
    },
    {
      "title": "Une décision prise avant qu’on y touche",
      "paragraphs": [
        "Ce qui frappe dans cette description, c’est le moment où les choses se jouent. La cristallisation n’a pas lieu quand on utilise l’objet, mais avant, au moment où il est conçu et construit. Une fois l’escalier coulé, une fois le logiciel installé sur les postes de travail, il est trop tard pour discuter de la hauteur des marches ou de l’ordre dans lequel les champs doivent être remplis : cette discussion, si elle a eu lieu, a eu lieu ailleurs, en amont, entre des personnes que celui qui utilise l’objet au quotidien n’a le plus souvent jamais rencontrées.",
        "C’est ce décalage qui rend l’idée utile pour comprendre ce qui se passe au travail. Une personne qui peine à utiliser un outil, qui doit ruser avec un logiciel mal pensé ou contourner une procédure absurde, n’est pas nécessairement en train de mal s’y prendre. Elle se heurte souvent à un modèle de son activité qui a été figé dans l’objet par quelqu’un d’autre, à un autre moment, sur la base d’une idée du travail qui ne correspondait peut-être déjà pas à ce que ce travail exige réellement."
      ]
    },
    {
      "title": "Une connaissance insuffisante du travail réel",
      "paragraphs": [
        "Pourquoi cet écart existe-t-il aussi souvent ? Béguin ne fait pas mystère de sa réponse : « ces choix sont le plus souvent réalisés à partir d’une connaissance insuffisante de la réalité du travail à réaliser ». Autrement dit, ce n’est pas d’abord une question de mauvaise volonté. Celui qui conçoit un outil se fait presque toujours une idée du travail plus simple, plus régulière et plus prévisible que ce que ce travail est réellement, une fois qu’il faut composer avec les pannes, les imprévus, les urgences et les arrangements que les personnes trouvent entre elles pour que les choses avancent quand même.",
        "Cette explication a une conséquence directe pour quiconque conçoit un outil de travail : il ne suffit pas de décrire ce que les personnes sont censées faire, il faut observer ce qu’elles font réellement, avec ses détours et ses ajustements, avant de figer quoi que ce soit dans la matière de l’objet. Une fois la cristallisation faite, revenir dessus coûte infiniment plus cher que de bien s’informer avant."
      ]
    },
    {
      "title": "Une hypothèse, pas une vérité figée",
      "paragraphs": [
        "Cette exigence ne revient pourtant pas à demander au concepteur une connaissance parfaite du travail, qui n’existe de toute façon nulle part avant que l’outil existe et soit réellement utilisé. Béguin réserve un mot précis pour ce que produit, au bout du compte, le travail de conception : une hypothèse. Ce que le concepteur met dans l’objet n’est jamais qu’un pari sur ce que sera le travail une fois l’outil en place, un pari que les personnes qui vont ensuite s’en servir peuvent confirmer, faire évoluer ou contredire par ce qu’elles apprennent en travaillant avec lui.",
        "Cette précision change le sens de tout ce qui précède. Cristalliser un modèle du travail dans un objet n’est pas une faute en soi : c’est ce que fait nécessairement toute conception, parce qu’il faut bien décider d’une forme à un moment donné. Le problème commence quand cette hypothèse initiale est traitée comme si elle était définitive, quand plus personne, une fois l’objet livré, n’a la possibilité de signaler qu’elle ne correspond pas à ce que le travail exige."
      ]
    },
    {
      "title": "Trois manières de répondre à ce problème",
      "paragraphs": [
        "Béguin ne s’arrête pas à décrire ce problème : il recense, dans des travaux menés par d’autres chercheurs, trois manières différentes d’y répondre, et prend soin de les distinguer plutôt que de les confondre. La première est celle que nous venons de suivre, la cristallisation : elle consiste à prendre très au sérieux, en amont, la connaissance du travail réel, pour que le modèle figé dans l’objet soit le plus juste possible dès le départ.",
        "Une deuxième piste, qu’il nomme la plasticité, s’appuie sur des travaux différents. On peut la comprendre comme une manière de déplacer le problème plutôt que de le résoudre entièrement en amont : plutôt que de chercher à figer d’emblée le bon modèle, concevoir des objets assez souples pour se prêter, une fois en usage, à plusieurs façons de travailler plutôt qu’à une seule.",
        "La troisième, le développement, ne cherche à fixer aucun modèle définitif à l’avance. Elle fait évoluer ensemble, dans la durée, l’objet et l’activité de ceux qui l’utilisent, au fil des usages et des ajustements successifs. C’est d’ailleurs vers cette troisième voie que penche la conclusion de Béguin, plus que vers la cristallisation seule : une bonne connaissance initiale du travail reste nécessaire, mais elle ne suffit jamais à elle seule à garantir qu’un objet restera adapté à un travail qui, avec le temps, change."
      ]
    },
    {
      "title": "Ce que l’objet ne fait pas tout seul",
      "paragraphs": [
        "Il faut se garder de confondre ce qu’un objet cristallise au moment où il est conçu avec ce qu’en fait ensuite la personne qui l’utilise. Une fois l’outil en main, chacun se l’approprie à sa manière, le détourne parfois, invente des façons de s’en servir que personne n’avait prévues : ce mouvement-là, qui se joue après coup, porte un autre nom dans les mêmes travaux d’ergonomie, où on l’appelle la genèse instrumentale, une notion mise en avant par Pierre Rabardel, qui a par ailleurs signé des travaux avec Béguin lui-même.",
        "La cristallisation dont parle Béguin se situe en amont de ce mouvement-là, pas à sa place. Un objet peut très bien porter un modèle du travail rigide et mal informé, et être malgré tout partiellement rattrapé par l’ingéniosité de ceux qui apprennent à le détourner. Mais cette ingéniosité a un coût, et elle n’efface pas ce que l’objet impose dès le départ : c’est justement pour épargner ce coût que Béguin s’adresse, dans ce texte, à ceux qui conçoivent les outils plutôt qu’à ceux qui doivent ensuite composer avec eux."
      ]
    }
  ],
  "limits": [
    "La version en langue anglaise de ce texte, publiée par la même revue, n’a été consultée que pour la phrase qui recoupe la citation retenue ici ; le reste de son contenu ne peut pas être invoqué au-delà de ce point précis.",
    "L’idée de cristallisation est antérieure à ce texte de 2007 : elle apparaît dès 1995 sous la plume de Pierre Rabardel, qui la rattache lui-même aux travaux de Léontiev. Léontiev n’a pas été lu directement pour préparer ce texte : cette filiation repose entièrement sur la manière dont Rabardel l’expose, pas sur une vérification dans le texte de Léontiev lui-même.",
    "Les travaux auxquels Béguin adosse chacune des trois voies qu’il distingue, parmi d’autres ceux de Bannon, de Freyssenet, de Suchman, de Daniellou, de Pastré ou de Clot, n’ont pas été ouverts pour préparer ce texte. Leur existence et leur pertinence sont établies par l’article lui-même, mais leur contenu propre ne peut pas être rapporté ici au-delà de ce qu’en dit Béguin."
  ]
}
